{
  "$schema": "./required-checks.schema.json",
  "version": 1,
  "policy_control_id": "GOV-CHECKS-001",
  "ruleset": {
    "name": "Public Main Protection - Strict External Review",
    "enforcement": "active",
    "strict_required_status_checks_policy": true
  },
  "checks": [
    {
      "gate_id": "GOV-GATE-BUILD-001",
      "kind": "workflow-job",
      "workflow": ".github/workflows/ci.yml",
      "job": "build-test",
      "context": "build-test",
      "scope": "all-pr",
      "trigger": {
        "mode": "unfiltered-pull-request",
        "event": "pull_request"
      },
      "producer": {
        "type": "github-actions-check",
        "integration_id": 15368,
        "app_slug": "github-actions"
      },
      "ruleset_integration_id": 15368,
      "allowed_conclusions": [
        "success"
      ],
      "timeout_minutes": 120,
      "staleness_policy": "exact-head-and-timeout",
      "rename": {
        "state": "stable",
        "previous_context": null,
        "previous_workflow": null,
        "previous_job": null,
        "migration_issue": null
      },
      "prerequisites": [
        "dotnet-build"
      ]
    },
    {
      "gate_id": "GOV-GATE-FRONTEND-001",
      "kind": "workflow-job",
      "workflow": ".github/workflows/ci.yml",
      "job": "frontend-test",
      "context": "frontend-test",
      "scope": "all-pr",
      "trigger": {
        "mode": "unfiltered-pull-request",
        "event": "pull_request"
      },
      "producer": {
        "type": "github-actions-check",
        "integration_id": 15368,
        "app_slug": "github-actions"
      },
      "ruleset_integration_id": 15368,
      "allowed_conclusions": [
        "success"
      ],
      "timeout_minutes": 120,
      "staleness_policy": "exact-head-and-timeout",
      "rename": {
        "state": "stable",
        "previous_context": null,
        "previous_workflow": null,
        "previous_job": null,
        "migration_issue": null
      },
      "prerequisites": [
        "frontend-build"
      ]
    },
    {
      "gate_id": "GOV-GATE-SECURITY-001",
      "kind": "workflow-job",
      "workflow": ".github/workflows/ci.yml",
      "job": "security-scan",
      "context": "security-scan",
      "scope": "all-pr",
      "trigger": {
        "mode": "unfiltered-pull-request",
        "event": "pull_request"
      },
      "producer": {
        "type": "github-actions-check",
        "integration_id": 15368,
        "app_slug": "github-actions"
      },
      "ruleset_integration_id": 15368,
      "allowed_conclusions": [
        "success"
      ],
      "timeout_minutes": 90,
      "staleness_policy": "exact-head-and-timeout",
      "rename": {
        "state": "stable",
        "previous_context": null,
        "previous_workflow": null,
        "previous_job": null,
        "migration_issue": null
      },
      "prerequisites": [
        "dotnet-build",
        "security-prepare",
        "security-runtime-core",
        "security-runtime-zap"
      ],
      "conditional_prerequisites": {
        "security-runtime-core": "needs.dotnet-build.outputs.security_compose == 'true'",
        "security-runtime-zap": "needs.dotnet-build.outputs.security_compose == 'true'"
      }
    },
    {
      "gate_id": "GOV-GATE-PUBLICATION-001",
      "kind": "workflow-job",
      "workflow": ".github/workflows/publication-readiness.yml",
      "job": "publication-readiness",
      "context": "publication-readiness",
      "scope": "all-pr",
      "trigger": {
        "mode": "unfiltered-pull-request",
        "event": "pull_request"
      },
      "producer": {
        "type": "github-actions-check",
        "integration_id": 15368,
        "app_slug": "github-actions"
      },
      "ruleset_integration_id": 15368,
      "allowed_conclusions": [
        "success"
      ],
      "timeout_minutes": 20,
      "staleness_policy": "exact-head-and-timeout",
      "rename": {
        "state": "stable",
        "previous_context": null,
        "previous_workflow": null,
        "previous_job": null,
        "migration_issue": null
      },
      "prerequisites": []
    },
    {
      "gate_id": "GOV-GATE-FUNCTIONAL-001",
      "kind": "workflow-job",
      "workflow": ".github/workflows/ci.yml",
      "job": "functional-fast",
      "context": "functional-fast",
      "scope": "all-pr",
      "trigger": {"mode": "unfiltered-pull-request", "event": "pull_request"},
      "producer": {"type": "github-actions-check", "integration_id": 15368, "app_slug": "github-actions"},
      "ruleset_integration_id": 15368,
      "allowed_conclusions": ["success"],
      "timeout_minutes": 5,
      "staleness_policy": "exact-head-and-timeout",
      "prerequisites": ["changes", "functional-runtime", "functional-run"],
      "conditional_prerequisites": {
        "functional-runtime": "needs.changes.outputs.functional == 'true'",
        "functional-run": "needs.changes.outputs.functional == 'true'"
      },
      "rename": {"state": "stable", "previous_context": null, "previous_workflow": null, "previous_job": null, "migration_issue": null}
    },
    {
      "gate_id": "GOV-GATE-PERFORMANCE-001",
      "kind": "workflow-job",
      "workflow": ".github/workflows/performance-api.yml",
      "job": "gate",
      "context": "performance-fast",
      "scope": "all-pr",
      "trigger": {"mode": "unfiltered-pull-request", "event": "pull_request"},
      "producer": {"type": "github-actions-check", "integration_id": 15368, "app_slug": "github-actions"},
      "ruleset_integration_id": 15368,
      "allowed_conclusions": ["success"],
      "timeout_minutes": 5,
      "staleness_policy": "exact-head-and-timeout",
      "prerequisites": ["route", "benchmark"],
      "conditional_prerequisites": {"benchmark": "needs.route.outputs.required == 'true'"},
      "rename": {"state": "stable", "previous_context": null, "previous_workflow": null, "previous_job": null, "migration_issue": null}
    }
  ]
}
